<?xml version="1.0" encoding="UTF-8"?>
<!-- Copyright DASSAULT SYSTEMES 2013 -->
<Config xmlns="DS_DELMIAMGAConfiguration" xmlns:xsi="http://www.w3.org/2001/XMLSchema-instance" xsi:schemaLocation="DS_DELMIAMGAConfiguration ../xsd/DELWebMfgAssetsDefUIEditLinkAttributes.xsd" Title="Displayed attributes by types for Edit Links" Description="Sample configuration file delivered by DS.">
  <DELAsmProcessCanUseCnx>
    <Attribute name="PLMEntity.V_description"           readOnly="true"/>
    <Attribute name="DELAsmProcessCanUseCnx.V_ResourcesQuantity"  readOnly="true"/>
<!--    <Attribute name="CGJMyDeploymentExtension.CGJMyAttribute1"  readOnly="true"/> -->
<!--    <Attribute name="CGJMyDeploymentExtension.CGJMyAttribute2"  readOnly="true"/> -->
<!--    <Attribute name="CGJMyDeploymentExtension.CGJMyAttribute3"  readOnly="true"/> -->
  </DELAsmProcessCanUseCnx>
  <HistorizationLinkRefRef>
             <Attribute name="PLMEntity.V_description"  readOnly="true"/>
  </HistorizationLinkRefRef>
  <DELLmiProductionSystemOutputCnxToMBOM>
             <Attribute name="DELLmiProductionSystemOutputCnxToMBOM.V_InTransit"  readOnly="true"/>
  </DELLmiProductionSystemOutputCnxToMBOM>
<!--  MGA-ImplementLink just for testing
  <ProcessImplementLinkOcc>
             <Attribute name="PLMEntity.V_description"  readOnly="true"/>
  </ProcessImplementLinkOcc>
  -->
</Config>
